situation_type,client_pattern,recommended_approach,example_response,notes
片思い,好きな人に連絡できず悶々としている,まず気持ちを受け止めた上で小さな一歩（LINE送信など）を提案する,"お気持ち、すごくよく伝わります。好きな気持ちが強いほど怖くなりますよね。まずは「最近どうですか？」のような軽いLINEから始めてみましょう。返信がなくても大丈夫、あなたの気持ちを少しだけ外に出すことが大事です。",行動のハードルを下げることが重要
片思い,相手のSNSを毎日チェックして一喜一憂している,SNS依存からの距離の取り方と現実のアクションへの転換を促す,"SNSのチェックがやめられないの、すごくわかります。でも相手の投稿に一喜一憂するより、直接関われる機会を作った方が確実に近づけます。今週、リアルで話せる場面を一つ作ってみましょう。",デジタル依存からリアル行動へシフト
マッチングアプリ,メッセージが長続きせずすぐフェードアウトされる,メッセージの質より早期に会う提案をする重要性を伝える,"マッチングアプリはテキストでの印象より会った時の印象の方がずっと大事です。メッセージを重ねるより、5〜6往復したら「よかったら一度お茶しませんか？」と誘ってみてください。フェードアウトされる前に動くのがコツです。",会うまでのスピードが成否を分ける
マッチングアプリ,プロフィールに自信がなくてなかなか「いいね」できない,プロフィール改善より「いいね」数を増やす行動を優先する,"プロフィールは完璧じゃなくていいです。まず100人に「いいね」してみましょう。反応を見ながら少しずつ磨いていく方が、試行錯誤なく改善するより何倍も早く成果が出ます。",行動量が最重要
復縁,別れた相手への未練が消えず新しい恋に進めない,冷却期間の重要性と自己成長に集中する提案をする,"今すぐ復縁を目指すより、まず3ヶ月間は連絡を控えてみてください。その間に自分自身が変わること（見た目・生活・趣味など）が、相手に再び振り向いてもらう一番の近道です。",冷却期間中の自己投資が鍵
復縁,頻繁に連絡してしまい相手に距離を置かれている,連絡頻度を下げることで相手の興味を取り戻す提案をする,"お気持ちは痛いほどわかります。でも今の状況では連絡を増やすほど相手が遠ざかってしまいます。まず2週間、連絡をぐっと我慢してみてください。距離を置くことで相手があなたのことを考える時間が生まれます。",希少性の法則
交際中,デートがマンネリ化してパートナーの反応が薄い,相手の好みを再リサーチして新鮮なデートプランを立てる提案をする,"マンネリは関係が安定している証でもありますが、たまには「特別感」を演出することが大切です。相手が最近話していたこと・行きたいと言っていた場所を思い出して、サプライズ的にプランしてみましょう。",サプライズと非日常感がポイント
交際中,パートナーとのコミュニケーションで言いたいことが言えない,Iメッセージを使った伝え方と話し合いの場の設け方を提案する,"「あなたが〜した」ではなく「私は〜と感じた」という伝え方に変えるだけで、相手の受け取り方がだいぶ変わります。落ち着いた夜に「少し話せる？」と場を設けて、責めずに気持ちを伝えてみてください。",Iメッセージで関係改善
